{
  "tripTitle": "京都旅遊行程 2026年5月",
  "dataVersion": "2026-05-20",
  "hero": {
    "headline": "京都・奈良・大阪｜關西家庭假期",
    "subheadline": "五日慢遊：啟程京都、千本鳥居與奈良、嵐山詩意、東山經典、大阪句點",
    "dateRange": "2026年5月23日–27日"
  },
  "meta": {
    "hotelName": "No.8 Kyoto",
    "hotelMapsUrl": "https://maps.app.goo.gl/oa4pmi1D1Wh3sHN79",
    "hotelSummary": "京都車站八條口步行約 6 分鐘、約 450m｜5/23–5/26 共 4 晚"
  },
  "days": [
    {
      "dateLabel": "5/23（六）",
      "sectionTitle": "啟程與京都初探",
      "tagline": "抵達古都車站樞紐，拉麵小路開胃，高空炭火串燒收尾第一日。",
      "highlights": [
        {
          "segment": "morning",
          "label": "抵達關西國際機場，通關取行李",
          "intro": "關西主門戶機場，入境後可銜接 JR／南海前往京阪神各地。",
          "mapsUrl": "https://maps.app.goo.gl/wEQTN44qFQanAo5d9"
        },
        {
          "segment": "morning",
          "label": "Haruka 特急前往京都",
          "intro": "JR 特急列車，關空直達京都站，適合攜帶大型行李移動。",
          "mapsUrl": "https://maps.app.goo.gl/jp4xxiEv1evw5gjY8"
        },
        {
          "segment": "lunch",
          "label": "京都站・拉麵小路",
          "intro": "京都重要交通樞紐；車站大樓 10 樓「拉麵小路」匯集北海道至九州各地代表性拉麵，抵達後迅速品嚐在地美味的首選。",
          "mapsUrl": "https://maps.app.goo.gl/jANLHDDgf7kS4CjV6"
        },
        {
          "segment": "afternoon",
          "label": "計程車至 No.8 Kyoto Check-in",
          "intro": "民宿鄰近京都站八條口，縮短推行李距離。",
          "mapsUrl": "https://maps.app.goo.gl/oa4pmi1D1Wh3sHN79"
        },
        {
          "segment": "dinner",
          "label": "こけこっこ（Kokekokko）",
          "intro": "京都車站大樓內的高空景觀餐廳，主打精緻炭火燒鳥；可眺望京都夜景，邊品嚐香氣四溢的日式串燒。",
          "mapsUrl": "https://maps.app.goo.gl/tL85BunMNzGD9PjE7"
        }
      ]
    },
    {
      "dateLabel": "5/24（日）",
      "sectionTitle": "千本鳥居與古都奈良之旅",
      "tagline": "伏見稻荷朱紅隧道、奈良釜飯與鹿群大佛，傍晚特急返京吃名物涮涮鍋。",
      "highlights": [
        {
          "segment": "morning",
          "label": "伏見稻荷大社（千本鳥居入口段）",
          "intro": "以密集紅色千本鳥居聞名，供奉商業與農業之神狐狸的聖地；入口段石板平緩，全家輕鬆漫步，感受光影穿透朱紅鳥居的神聖氛圍。",
          "mapsUrl": "https://maps.app.goo.gl/Bok763JvSoPGxvrw9"
        },
        {
          "segment": "lunch",
          "label": "志津香釜飯大宮店",
          "intro": "奈良超人氣排隊名店，傳統鍋具現點現煮的釜飯，底部帶微微焦香鍋巴，融合肉類與海鮮鮮甜，風味絕佳。",
          "mapsUrl": "https://maps.app.goo.gl/MeLvUX6w5LJDxXki9"
        },
        {
          "segment": "afternoon",
          "label": "奈良公園、東大寺、春日大社",
          "intro": "公園內溫馴鹿自由漫步；東大寺為世界最大木造建築，殿內 15 公尺大佛震撼；春日大社以萬千石燈籠展現幽靜古社之美（巴士接駁與坡道規劃友善長輩）。",
          "mapsUrl": "https://maps.app.goo.gl/UW39aopLceEvYXVs5"
        },
        {
          "segment": "evening",
          "label": "近鐵特急至近鐵京都站",
          "intro": "近鐵特急行駛奈良至近鐵京都站，省時直達；須另購特急券且席別依列車規定。",
          "mapsUrl": "https://maps.app.goo.gl/CHb12vZ84Nmk433y5"
        },
        {
          "segment": "dinner",
          "label": "瓢斗 Hyoto 京都站前本店",
          "intro": "京都名物「出汁しゃぶ」名店：嚴選薄切肉放入特製高湯輕涮，搭配九條蔥與秘製沾醬，入口即化，細緻不負擔，適合長輩。",
          "mapsUrl": "https://maps.app.goo.gl/AUcRG56UYhPoeapY7"
        }
      ]
    },
    {
      "dateLabel": "5/25（一）",
      "sectionTitle": "嵐山全日詩意漫步",
      "tagline": "翠竹禪意、天龍寺精進、小火車與保津川，渡月橋畔抹茶，百年鰻魚飯收尾。",
      "highlights": [
        {
          "segment": "morning",
          "label": "竹林小徑、野宮神社",
          "intro": "漫步高聳青翠竹林，彷彿世外桃源；途中經過以祈求姻緣與學業聞名的野宮神社。",
          "mapsUrl": "https://maps.app.goo.gl/hnz1NYXChUGBYZnj7"
        },
        {
          "segment": "lunch",
          "label": "天龍寺 篩月 精進料理",
          "intro": "世界遺產天龍寺境內的精進料理（禪風素食），融合四季食材；可邊用餐邊欣賞曹源池庭園（入園與預約依現場規定）。",
          "mapsUrl": "https://maps.app.goo.gl/o9u7FiC7fgALirqy8"
        },
        {
          "segment": "afternoon",
          "label": "嵯峨野觀光小火車・保津川遊船・渡月橋",
          "intro": "復古小火車穿梭保津川峽谷，換乘人工撐篙遊船順流而下；終點渡月橋畔下船，適合抹茶甜點靜享午後。",
          "mapsUrl": "https://maps.app.goo.gl/4MU2QyGaHF2Xnp5KA"
        },
        {
          "segment": "dinner",
          "label": "京極かねよ（Kyogoku Kaneyo）",
          "intro": "百年歷史鰻魚飯老店，名物「玉子燒鰻魚飯」（きんし丼）覆蓋厚煎蛋，炭烤鰻魚醬香與綿密蛋香完美融合。",
          "mapsUrl": "https://maps.app.goo.gl/g8LRtMKPkK6UQtRK8"
        }
      ]
    },
    {
      "dateLabel": "5/26（二）",
      "sectionTitle": "東山經典與花見小路",
      "tagline": "錦市場京之廚房、清水舞台巡禮，石板古街與八坂風情，頂級和牛燒肉為京都最後一夜。",
      "highlights": [
        {
          "segment": "breakfast",
          "label": "錦市場邊走邊吃",
          "intro": "譽為「京都的廚房」，數百公尺商店街匯集傳統食材、漬物、海鮮與在地小吃，最適合邊走邊吃體驗庶民文化。",
          "mapsUrl": "https://maps.app.goo.gl/Rp8ZH8qbNibqDkS69"
        },
        {
          "segment": "morning",
          "label": "清水寺",
          "intro": "京都最古老寺院之一，巨大木造「清水舞台」未用一根釘子，懸空眺望京都市景極為壯觀（參拜需現金）。",
          "mapsUrl": "https://maps.app.goo.gl/ySG8B8N3cvg3eWca7"
        },
        {
          "segment": "afternoon",
          "label": "二年坂、高台寺、八坂神社、花見小路",
          "intro": "沿江戶風情石板古道漫步，經高台寺與守護京都的八坂神社；傍晚「花見小路」兩旁古樸木造茶屋，運氣好可見藝妓步履。",
          "mapsUrl": "https://maps.app.goo.gl/MSXh9Y7mq2BunvYE7"
        },
        {
          "segment": "dinner",
          "label": "りきちゃん（Rikichan）祇園店",
          "intro": "祇園頂級燒肉名店，主打近江牛與黑毛和牛，厚切牛排入口即化，為京都最後一晚留下奢華美味回憶。",
          "mapsUrl": "https://maps.app.goo.gl/W5cZgsFgUkVqqat48"
        }
      ]
    },
    {
      "dateLabel": "5/27（三）",
      "sectionTitle": "大阪商圈與美味蛋包飯",
      "tagline": "黑門市場朝聖、心齋橋道頓堀血拚，百年蛋包飯始祖為旅程畫下句點。",
      "highlights": [
        {
          "segment": "morning",
          "label": "JR／地鐵至大阪難波、Yamato 行李寄放",
          "intro": "難波周邊集結商店街；黑貓據點可日寄行李，方便下午血拚。",
          "mapsUrl": "https://maps.app.goo.gl/nJ5nQwonh8bcEPbE6"
        },
        {
          "segment": "lunch",
          "label": "黑門市場邊走邊吃",
          "intro": "大阪著名海鮮與美食天堂，現烤神戶牛、巨型草蝦、新鮮黑鮪與當季水果應有盡有。",
          "mapsUrl": "https://maps.app.goo.gl/wZjYRaxAJURqqjsy9"
        },
        {
          "segment": "afternoon",
          "label": "心齋橋、道頓堀逛街購物",
          "intro": "大阪最熱鬧購物美食街，巨大固力果跑跑人招牌必拍，藥妝與品牌旗艦店琳瑯滿目。",
          "mapsUrl": "https://maps.app.goo.gl/D3DKCz478T12kfib6"
        },
        {
          "segment": "dinner",
          "label": "北極星蛋包飯心齋橋本店",
          "intro": "傳承百年的日式蛋包飯創始店，町家風格老建築內，鮮嫩滑蛋包裹香氣炒飯、淋上秘製醬汁，老少咸宜的完美句點。",
          "mapsUrl": "https://maps.app.goo.gl/FkJfmK1u1UChgzf1A"
        },
        {
          "segment": "evening",
          "label": "南海難波搭南海線至關西國際機場",
          "intro": "難波直達關空的鐵道路線，適合班機前移動。",
          "mapsUrl": "https://maps.app.goo.gl/7L91sNQzSNoKifb76"
        }
      ]
    }
  ]
}
